university_id,major_name_en,major_name_cn,degree_level,is_active,notes
2686,Master of Social Sciences in the field of Psychology,社会科学硕士（心理学）,master,1,https://handbook.hku.hk/tpg/pdf/2025/2025_PG_COURSEWORK%20PROGRAMMES%20ADVISORS_final2.pdf
2686,Master of Social Sciences in the field of Social Data Analytics,社会科学硕士（社会数据分析）,master,1,https://handbook.hku.hk/tpg/pdf/2025/2025_PG_COURSEWORK%20PROGRAMMES%20ADVISORS_final2.pdf
2686,Master of Social Sciences in the field of Social Service Management,社会科学硕士（社会服务管理）,master,1,https://handbook.hku.hk/tpg/pdf/2025/2025_PG_COURSEWORK%20PROGRAMMES%20ADVISORS_final2.pdf
2686,Master of Social Sciences in the field of Sociology,社会科学硕士（社会学）,master,1,https://handbook.hku.hk/tpg/pdf/2025/2025_PG_COURSEWORK%20PROGRAMMES%20ADVISORS_final2.pdf
2686,Master of Social Sciences in the field of Sustainability Leadership and Governance,社会科学硕士（可持续发展领导力与治理）,master,1,https://handbook.hku.hk/tpg/pdf/2025/2025_PG_COURSEWORK%20PROGRAMMES%20ADVISORS_final2.pdf
2686,Master of Social Work,社会工作硕士,master,1,https://handbook.hku.hk/tpg/pdf/2025/2025_PG_COURSEWORK%20PROGRAMMES%20ADVISORS_final2.pdf
2686,Master of Transport Policy and Planning,交通政策与规划硕士,master,1,https://handbook.hku.hk/tpg/pdf/2025/2025_PG_COURSEWORK%20PROGRAMMES%20ADVISORS_final2.pdf
2686,Master of Philosophy (MPhil),哲学硕士,master,1,https://handbook.hku.hk/tpg/pdf/2025/2025_PG_COURSEWORK%20PROGRAMMES%20ADVISORS_final2.pdf
2686,Doctor of Business Administration,工商管理博士,master,1,https://handbook.hku.hk/tpg/pdf/2025/2025_PG_COURSEWORK%20PROGRAMMES%20ADVISORS_final2.pdf
2686,Doctor of Education,教育学博士,master,1,https://handbook.hku.hk/tpg/pdf/2025/2025_PG_COURSEWORK%20PROGRAMMES%20ADVISORS_final2.pdf
2686,Juris Doctor,JurisDoctor,master,1,https://handbook.hku.hk/tpg/pdf/2025/2025_PG_COURSEWORK%20PROGRAMMES%20ADVISORS_final2.pdf
2686,Doctor of Nursing,护理学博士,master,1,https://handbook.hku.hk/tpg/pdf/2025/2025_PG_COURSEWORK%20PROGRAMMES%20ADVISORS_final2.pdf
2686,Doctor of Psychology (Clinical Psychology),心理学（Clinical心理学）博士,master,1,https://handbook.hku.hk/tpg/pdf/2025/2025_PG_COURSEWORK%20PROGRAMMES%20ADVISORS_final2.pdf
2686,Doctor of Psychology (Educational Psychology),心理学（教育心理学）博士,master,1,https://handbook.hku.hk/tpg/pdf/2025/2025_PG_COURSEWORK%20PROGRAMMES%20ADVISORS_final2.pdf
2686,Doctor of Public Administration,PublicAdministration博士,master,1,https://handbook.hku.hk/tpg/pdf/2025/2025_PG_COURSEWORK%20PROGRAMMES%20ADVISORS_final2.pdf
2686,Doctor of Philosophy (PhD),哲学博士,master,1,https://handbook.hku.hk/tpg/pdf/2025/2025_PG_COURSEWORK%20PROGRAMMES%20ADVISORS_final2.pdf
