university_id,degree_level,major_name_en,major_name_cn,is_active,notes
43,master,Master of Clinical Exercise Physiology (coursework or coursework and dissertation),临床运动生理学硕士（授课型或授课型+论文）,1,UWA Handbook 2026 course search (type=courses); code=73520; accessed=2026-01-19; source=https://handbooks.uwa.edu.au/search?type=courses
43,master,Master of Infectious Diseases (coursework or coursework and dissertation),传染病学硕士（授课型或授课型+论文）,1,UWA Handbook 2026 course search (type=courses); code=54540; accessed=2026-01-19; source=https://handbooks.uwa.edu.au/search?type=courses
43,master,Master of Marine Biology (coursework or coursework and dissertation),海洋生物学硕士（授课型或授课型+论文）,1,UWA Handbook 2026 course search (type=courses); code=74540; accessed=2026-01-19; source=https://handbooks.uwa.edu.au/search?type=courses
43,master,Master of Forensic Anthropology (coursework and dissertation),法医人类学硕士（授课型+论文）,1,UWA Handbook 2026 course search (type=courses); code=72580; accessed=2026-01-19; source=https://handbooks.uwa.edu.au/search?type=courses
43,master,Master of Business Psychology (coursework),商业心理学硕士（授课型）,1,UWA Handbook 2026 course search (type=courses); code=73550; accessed=2026-01-19; source=https://handbooks.uwa.edu.au/search?type=courses
43,master,Master of Exercise Science (thesis and coursework),运动科学硕士（论文+授课）,1,UWA Handbook 2026 course search (type=courses); code=51610; accessed=2026-01-19; source=https://handbooks.uwa.edu.au/search?type=courses
43,master,Master of Science (thesis and coursework),理学硕士（论文+授课）,1,UWA Handbook 2026 course search (type=courses); code=70630; accessed=2026-01-19; source=https://handbooks.uwa.edu.au/search?type=courses
43,master,Master of Education (coursework and dissertation),教育学硕士（授课型+论文）,1,UWA Handbook 2026 course search (type=courses); code=30580; accessed=2026-01-19; source=https://handbooks.uwa.edu.au/search?type=courses
43,master,Master of Clinical Pathology (coursework or coursework and dissertation),临床病理学硕士（授课型或授课型+论文）,1,UWA Handbook 2026 course search (type=courses); code=92510; accessed=2026-01-19; source=https://handbooks.uwa.edu.au/search?type=courses
43,master,Master of Pathology (thesis and coursework),病理学硕士（论文+授课）,1,UWA Handbook 2026 course search (type=courses); code=92610; accessed=2026-01-19; source=https://handbooks.uwa.edu.au/search?type=courses
43,master,Master of Music (research),音乐硕士（研究型）,1,UWA Handbook 2026 course search (type=courses); code=10720; accessed=2026-01-19; source=https://handbooks.uwa.edu.au/search?type=courses
43,master,Master of Advanced Social Work (research),高级社会工作硕士（研究型）,1,UWA Handbook 2026 course search (type=courses); code=10750; accessed=2026-01-19; source=https://handbooks.uwa.edu.au/search?type=courses
