university_id,major_name_en,major_name_cn,degree_level,is_active,notes
2712,Researching Crisis and Change in Human Geography MA,ResearchingCrisis与变革人体地理学（MA）,master,1,https://www.liverpool.ac.uk/courses/researching-crisis-and-change-in-human-geography-ma
2712,Robotics and the Internet of Things MSc (Eng),机器人与物联网（MSc (Eng)）,master,1,https://www.liverpool.ac.uk/courses/robotics-and-the-internet-of-things-msc-eng
2712,Robotics and the Internet of Things with a Year in Industry MSc (Eng),机器人与物联网（含一年行业实习）（MSc (Eng)）,master,1,https://www.liverpool.ac.uk/courses/robotics-and-the-internet-of-things-with-a-year-in-industry-msc-eng
2712,Screen Studies MA,Screen研究（MA）,master,1,https://www.liverpool.ac.uk/courses/screen-studies-ma
2712,Social Research MRes,社会研究（MRes）,master,1,https://www.liverpool.ac.uk/courses/social-research-mres
2712,Social Research Methods MA,社会研究方法（MA）,master,1,https://www.liverpool.ac.uk/courses/social-research-methods-ma
2712,Sociolinguistics - Modern Languages and Cultures MRes,Sociolinguistics-现代语言与文化（MRes）,master,1,https://www.liverpool.ac.uk/courses/sociolinguistics-modern-languages-and-cultures-mres
2712,Spanish Studies - Modern Languages and Cultures MRes,西班牙语研究-现代语言与文化（MRes）,master,1,https://www.liverpool.ac.uk/courses/spanish-studies-modern-languages-and-cultures-mres
2712,Sports Business and Analytics MSc,体育商业与分析（MSc）,master,1,https://www.liverpool.ac.uk/courses/sports-business-analytics-msc
2712,Sports Business and Management MSc,体育商业与管理学（MSc）,master,1,https://www.liverpool.ac.uk/courses/sports-business-and-management-msc
2712,Strategic Communication MSc,Strategic传播学（MSc）,master,1,https://www.liverpool.ac.uk/courses/strategic-communication-msc
2712,Sustainable Business MSc,可持续商业（MSc）,master,1,https://www.liverpool.ac.uk/courses/sustainable-business-msc
2712,Sustainable Civil and Structural Engineering MSc (Eng),可持续土木与结构工程（MSc (Eng)）,master,1,https://www.liverpool.ac.uk/courses/sustainable-civil-and-structural-engineering-msc-eng
2712,Sustainable Heritage Management MA,可持续遗产管理学（MA）,master,1,https://www.liverpool.ac.uk/courses/sustainable-heritage-management-ma
2712,Sustainable Urban Planning MA,可持续城市规划（MA）,master,1,https://www.liverpool.ac.uk/courses/sustainable-urban-planning-ma
2712,Teaching English to Speakers of Other Languages (TESOL) MA,对外英语教学（TESOL）（MA）,master,1,https://www.liverpool.ac.uk/courses/teaching-english-to-speakers-of-other-languages-tesol-ma
2712,"The Beatles, Heritage and Culture MA","Beatles,遗产与文化（MA）",master,1,https://www.liverpool.ac.uk/courses/the-beatles-heritage-and-culture-ma-online
2712,Theoretical Computer Science MSc,理论计算机科学（MSc）,master,1,https://www.liverpool.ac.uk/courses/theoretical-computer-science-msc
2712,Theoretical Computer Science with a Year in Industry MSc,理论计算机科学（含一年行业实习）（MSc）,master,1,https://www.liverpool.ac.uk/courses/theoretical-computer-science-with-a-year-in-industry-msc
2712,Therapeutic Radiography and Oncology (Pre-registration) MSc,放射治疗与肿瘤学（预注册）（MSc）,master,1,https://www.liverpool.ac.uk/courses/therapeutic-radiography-and-oncology-pre-registration-msc
2712,Tourism Marketing and Analytics MSc,Tourism市场营销与分析（MSc）,master,1,https://www.liverpool.ac.uk/courses/tourism-marketing-and-analytics-msc
2712,Town and Regional Planning MCD,城市与区域规划（MCD）,master,1,https://www.liverpool.ac.uk/courses/town-and-regional-planning-mcd
2712,Translation MA,翻译（MA）,master,1,https://www.liverpool.ac.uk/courses/translation-ma
2712,Translation Studies - Modern Languages and Cultures MRes,翻译研究-现代语言与文化（MRes）,master,1,https://www.liverpool.ac.uk/courses/translation-studies-modern-languages-and-cultures-mres
2712,University of Law at Liverpool,University法学atLiverpool,master,1,https://www.liverpool.ac.uk/courses/university-of-law-at-liverpool
2712,Urban Design and Planning MCD,城市设计与规划（MCD）,master,1,https://www.liverpool.ac.uk/courses/urban-design-and-planning-mcd
2712,Veterinary Business Management (VBM) PGCert,兽医工商管理（VBM）（PGCert）,master,1,https://www.liverpool.ac.uk/courses/veterinary-business-management-vbm-pgcert
2712,Veterinary Physiotherapy MSc,兽医物理治疗（MSc）,master,1,https://www.liverpool.ac.uk/courses/veterinary-physiotherapy-postgraduate-diploma-msc
2712,Veterinary Physiotherapy MSc,兽医物理治疗（MSc）,master,1,https://www.liverpool.ac.uk/courses/veterinary-physiotherapy-msc
2712,Veterinary Professional Studies MSc,兽医Professional研究（MSc）,master,1,https://www.liverpool.ac.uk/courses/veterinary-professional-studies-postgraduate-certificate-diploma-msc
2712,Visual Culture MA,Visual文化（MA）,master,1,https://www.liverpool.ac.uk/courses/media-culture-and-everyday-life-ma
2712,Wildlife Health and Conservation​ MSc,Wildlife健康与Conservation​（MSc）,master,1,https://www.liverpool.ac.uk/courses/wildlife-health-and-conservation-msc
