university_id,major_name_en,major_name_cn,degree_level,is_active,notes
2714,Environmental Leadership and Management MSc,环境领导力与管理（MSc）,master,1,https://www.nottingham.ac.uk/pgstudy/course/taught/environmental-leadership-and-management-msc
2714,Environmental Process Engineering MSc,环境过程工程（MSc）,master,1,https://www.nottingham.ac.uk/pgstudy/course/taught/environmental-process-engineering-msc
2714,Film and Television Studies MRes,电影与电视研究（MRes）,master,1,https://www.nottingham.ac.uk/pgstudy/course/research/film-and-television-studies-mres
2714,"Film, Television and Screen Industries MA",电影、电视与影视产业（MA）,master,1,https://www.nottingham.ac.uk/pgstudy/course/taught/film-television-and-screen-industries-ma
2714,Finance and Investment MSc,金融与投资（MSc）,master,1,https://www.nottingham.ac.uk/pgstudy/course/taught/finance-and-investment-msc
2714,Financial Economics MSc,金融经济学（MSc）,master,1,https://www.nottingham.ac.uk/pgstudy/course/taught/financial-economics-msc
2714,Financial Technology MSc,金融技术（MSc）,master,1,https://www.nottingham.ac.uk/pgstudy/course/taught/financial-technology-msc
2714,Food Process Engineering MSc,食品加工工程（MSc）,master,1,https://www.nottingham.ac.uk/pgstudy/course/taught/food-process-engineering-msc
2714,Food Production Management MSc,食品生产管理（MSc）,master,1,https://www.nottingham.ac.uk/pgstudy/course/taught/food-production-management-msc
2714,Forensic and Criminological Psychology MSc,法医与犯罪学心理学（MSc）,master,1,https://www.nottingham.ac.uk/pgstudy/course/taught/forensic-and-criminological-psychology-msc
2714,Geography MRes/(Sc) MRes,地理学（MRes）,master,1,https://www.nottingham.ac.uk/pgstudy/course/research/geography-mres
2714,Global Environmental Sustainability MSc,全球环境可持续发展（MSc）,master,1,https://www.nottingham.ac.uk/pgstudy/course/taught/global-environmental-sustainability-msc
2714,Global Social and Public Policy MA,全球社会与公共政策（MA）,master,1,https://www.nottingham.ac.uk/pgstudy/course/taught/global-social-and-public-policy-ma
2714,"Gravity, Particles and Fields MSc","引力,颗粒与场（MSc）",master,1,https://www.nottingham.ac.uk/pgstudy/course/taught/gravity-particles-and-fields-msc
2714,Health Psychology MSc,健康心理学（MSc）,master,1,https://www.nottingham.ac.uk/pgstudy/course/taught/health-psychology-msc
2714,History MA,历史学（MA）,master,1,https://www.nottingham.ac.uk/pgstudy/course/taught/history-ma
2714,Human Computer Interaction MSc,人类计算机交互（MSc）,master,1,https://www.nottingham.ac.uk/pgstudy/course/taught/human-computer-interaction-msc
2714,Human Factors and Ergonomics MSc,人类因素与人因工程（MSc）,master,1,https://www.nottingham.ac.uk/pgstudy/course/taught/human-factors-and-ergonomics-msc
2714,Human Resource Management and Organisation MSc,人力资源管理与组织（MSc）,master,1,https://www.nottingham.ac.uk/pgstudy/course/taught/human-resource-management-and-organisation-msc
2714,Human Rights Law LLM,人权法（LLM）,master,1,https://www.nottingham.ac.uk/pgstudy/course/taught/human-rights-law-llm
2714,Immunology and Immunotherapeutics MSc,免疫学与免疫治疗（MSc）,master,1,https://www.nottingham.ac.uk/pgstudy/course/taught/immunology-and-immunotherapeutics-msc
2714,Industrial Engineering and Operations Management MSc,工业工程与运营管理（MSc）,master,1,https://www.nottingham.ac.uk/pgstudy/course/taught/industrial-engineering-and-operations-management-msc
2714,Information Systems and Operations Management MSc,信息系统与运营管理（MSc）,master,1,https://www.nottingham.ac.uk/pgstudy/course/taught/information-systems-and-operations-management-msc
2714,International Business MSc,国际商务（MSc）,master,1,https://www.nottingham.ac.uk/pgstudy/course/taught/international-business-msc
2714,International Business and Commercial Law LLM,国际商务与商法（LLM）,master,1,https://www.nottingham.ac.uk/pgstudy/course/taught/international-business-and-commercial-law-llm
2714,International Economics MSc,国际经济学（MSc）,master,1,https://www.nottingham.ac.uk/pgstudy/course/taught/international-economics-msc
2714,International Law LLM,国际法（LLM）,master,1,https://www.nottingham.ac.uk/pgstudy/course/taught/international-law-llm
2714,International Media and Communication Studies MA,国际媒体与传播研究（MA）,master,1,https://www.nottingham.ac.uk/pgstudy/course/taught/international-media-and-communication-studies-ma
2714,International Relations MA,国际关系（MA）,master,1,https://www.nottingham.ac.uk/pgstudy/course/taught/international-relations-ma
2714,International Security and Terrorism MA,国际安全与恐怖主义（MA）,master,1,https://www.nottingham.ac.uk/pgstudy/course/taught/international-security-and-terrorism-ma
2714,International Tourism Management and Marketing MSc,国际旅游管理与市场营销（MSc）,master,1,https://www.nottingham.ac.uk/pgstudy/course/taught/international-tourism-management-and-marketing-msc
2714,Law (Master of Laws) LLM,法学（法学硕士路径）（LLM）,master,1,https://www.nottingham.ac.uk/pgstudy/course/taught/master-of-laws-llm
2714,Logistics and Supply Chain Management MSc,物流与供应链管理（MSc）,master,1,https://www.nottingham.ac.uk/pgstudy/course/taught/logistics-and-supply-chain-management-msc
2714,Machine Learning in Science MSc,科学中的机器学习（MSc）,master,1,https://www.nottingham.ac.uk/pgstudy/course/taught/machine-learning-in-science-msc
2714,Management MSc,管理（MSc）,master,1,https://www.nottingham.ac.uk/pgstudy/course/taught/management-msc
2714,Marketing MSc,市场营销（MSc）,master,1,https://www.nottingham.ac.uk/pgstudy/course/taught/marketing-msc
2714,Master of Public Administration MPA,硕士公共管理（MPA）,master,1,https://www.nottingham.ac.uk/pgstudy/course/taught/master-of-public-administration-mpa
2714,Mechanical Engineering MSc,机械工程（MSc）,master,1,https://www.nottingham.ac.uk/pgstudy/course/taught/mechanical-engineering-msc
2714,Microbiology and Immunology MSc,微生物学与免疫学（MSc）,master,1,https://www.nottingham.ac.uk/pgstudy/course/taught/microbiology-and-immunology-msc
2714,Modern Languages MRes,现代语言（MRes）,master,1,https://www.nottingham.ac.uk/pgstudy/course/research/modern-languages-mres
2714,Music MRes,音乐（MRes）,master,1,https://www.nottingham.ac.uk/pgstudy/course/research/music-mres
2714,Occupational Psychology MSc,职业心理学（MSc）,master,1,https://www.nottingham.ac.uk/pgstudy/course/taught/occupational-psychology-msc
2714,Person-Centred Experiential Counselling and Psychotherapy MA,以人为中心的体验式咨询与心理治疗（MA）,master,1,https://www.nottingham.ac.uk/pgstudy/course/taught/person-centred-experiential-counselling-and-psychotherapy-ma
2714,Politics and Contemporary History MA,政治学与当代历史（MA）,master,1,https://www.nottingham.ac.uk/pgstudy/course/taught/politics-and-contemporary-history-ma
2714,Politics and International Relations MRes,政治学与国际关系（MRes）,master,1,https://www.nottingham.ac.uk/pgstudy/course/research/politics-and-international-relations-mres
2714,Psychology (Conversion) Distance Learning MSc,心理学(转专业)远程学习（MSc）,master,1,https://www.nottingham.ac.uk/pgstudy/course/taught/psychology-conversion-msc-distance
2714,Psychology (Conversion) MSc,心理学(转专业)（MSc）,master,1,https://www.nottingham.ac.uk/pgstudy/course/taught/psychology-conversion-msc
2714,Psychology Research Methods MSc,心理学研究方法（MSc）,master,1,https://www.nottingham.ac.uk/pgstudy/course/taught/psychology-research-methods-msc
2714,Quantum Science and Technology MSc,量子科学与技术（MSc）,master,1,https://www.nottingham.ac.uk/pgstudy/course/taught/quantum-science-and-technology-msc
2714,Religious Studies MRes,宗教研究（MRes）,master,1,https://www.nottingham.ac.uk/pgstudy/course/research/religious-studies-mres
2714,Risk Management MSc,风险管理（MSc）,master,1,https://www.nottingham.ac.uk/pgstudy/course/taught/risk-management-msc
2714,Screen Translation MA,影视翻译（MA）,master,1,https://www.nottingham.ac.uk/pgstudy/course/taught/screen-translation-ma
2714,"Social Science Research (Criminology, Sociology, Social Policy, Social Work) MA","社会科学研究(犯罪学,社会学,社会政策,社会工作)（MA）",master,1,https://www.nottingham.ac.uk/pgstudy/course/taught/social-science-research-criminology-sociology-social-policy-social-work-ma
2714,Social Science Research (Political Science and International Relations) MA,社会科学研究(政治科学与国际关系)（MA）,master,1,https://www.nottingham.ac.uk/pgstudy/course/taught/social-science-research-political-science-and-international-relations-ma
2714,Special and Inclusive Education (Online) MA,特殊与包容性教育（在线）（MA）,master,1,https://www.nottingham.ac.uk/pgstudy/course/taught/special-and-inclusive-education-online-ma
2714,Special and Inclusive Education MA,特殊与包容性教育（MA）,master,1,https://www.nottingham.ac.uk/pgstudy/course/taught/special-and-inclusive-education-ma
2714,Sports and Exercise Medicine MSc,体育与运动医学（MSc）,master,1,https://www.nottingham.ac.uk/pgstudy/course/taught/sports-and-exercise-medicine-msc
2714,Statistical Science (Distance Learning) MSc,统计科学（远程学习）（MSc）,master,1,https://www.nottingham.ac.uk/pgstudy/course/taught/statistical-science-distance-learning-msc
2714,Statistics MSc,统计学（MSc）,master,1,https://www.nottingham.ac.uk/pgstudy/course/taught/statistics-msc
2714,Stem Cell Technology and Regenerative Medicine MSc,理工科细胞技术与再生医学（MSc）,master,1,https://www.nottingham.ac.uk/pgstudy/course/taught/stem-cell-technology-and-regenerative-medicine-msc
2714,Structural Engineering - Digital Construction MSc,结构工程-数字建造（MSc）,master,1,https://www.nottingham.ac.uk/pgstudy/course/taught/structural-engineering-digital-construction-msc
2714,Supply Chain and Operations Management MSc,供应链与运营管理（MSc）,master,1,https://www.nottingham.ac.uk/pgstudy/course/taught/supply-chain-and-operations-management-msc
2714,Sustainable Building Technology MSc,可持续建筑技术（MSc）,master,1,https://www.nottingham.ac.uk/pgstudy/course/taught/sustainable-building-technology-msc
2714,Sustainable Energy Engineering  MSc,可持续能源工程（MSc）,master,1,https://www.nottingham.ac.uk/pgstudy/course/taught/sustainable-energy-engineering-msc
2714,Sustainable Energy and Entrepreneurship  MSc,可持续能源与创业（MSc）,master,1,https://www.nottingham.ac.uk/pgstudy/course/taught/sustainable-energy-and-entrepreneurship-msc
2714,Sustainable Urban Design MArch,可持续城市设计（MArch）,master,1,https://www.nottingham.ac.uk/pgstudy/course/taught/sustainable-urban-design-march
2714,Teaching Chinese to Speakers of Other Languages (TCSOL) MA,教学中国到母语者其他语言(对外汉语教学)（MA）,master,1,https://www.nottingham.ac.uk/pgstudy/course/taught/teaching-chinese-to-speakers-of-other-languages-tcsol-ma
2714,Teaching English to Speakers of Other Languages (TESOL) MA,教学英语到母语者其他语言(对外英语教学)（MA）,master,1,https://www.nottingham.ac.uk/pgstudy/course/taught/teaching-english-to-speakers-of-other-languages-tesol-ma
2714,Technology and Intellectual Property Law LLM,技术与知识产权产权法学（LLM）,master,1,https://www.nottingham.ac.uk/pgstudy/course/taught/technology-and-intellectual-property-law-llm
2714,Theology MRes,神学（MRes）,master,1,https://www.nottingham.ac.uk/pgstudy/course/research/theology-mres
2714,Theology and Religious Studies MPhil,神学与宗教研究（MPhil）,master,1,https://www.nottingham.ac.uk/pgstudy/course/research/theology-and-religious-studies-mphil
2714,Trauma Informed Practice MA,创伤知情实践（MA）,master,1,https://www.nottingham.ac.uk/pgstudy/course/taught/trauma-informed-practice-ma
2714,Veterinary Medicine/Surgery MVM/MVS,兽医医学/外科（MVM/MVS）,master,1,https://www.nottingham.ac.uk/pgstudy/course/research/veterinary-medicine-mvm-mvs
2714,Veterinary Physiotherapy MSc,兽医物理治疗（MSc）,master,1,https://www.nottingham.ac.uk/pgstudy/course/taught/veterinary-physiotherapy-msc
2714,Veterinary Science MRes,兽医科学（MRes）,master,1,https://www.nottingham.ac.uk/pgstudy/course/research/veterinary-science-mres
2714,Visual Culture MRes,视觉文化（MRes）,master,1,https://www.nottingham.ac.uk/pgstudy/course/research/visual-culture-mres
