university_id,major_name_en,major_name_cn,degree_level,is_active,notes
2714,Accountancy BSc Hons,会计（BSc）,bachelor,1,https://www.nottingham.ac.uk/fees/tuitionfees/202526/undergraduate.aspx
2714,Aerospace Engineering BEng Hons,航空航天工程（BEng）,bachelor,1,https://www.nottingham.ac.uk/fees/tuitionfees/202526/undergraduate.aspx
2714,Aerospace Engineering MEng Hons,航空航天工程（MEng）,bachelor,1,https://www.nottingham.ac.uk/fees/tuitionfees/202526/undergraduate.aspx
2714,Aerospace Engineering including an Industrial Year BEng Hons,航空航天工程（行业实习年）（BEng）,bachelor,1,https://www.nottingham.ac.uk/fees/tuitionfees/202526/undergraduate.aspx
2714,Aerospace Engineering including an Industrial Year MEng Hons,航空航天工程（行业实习年）（MEng）,bachelor,1,https://www.nottingham.ac.uk/fees/tuitionfees/202526/undergraduate.aspx
2714,Agricultural Business Management BSc Hons,农业商务管理（BSc）,bachelor,1,https://www.nottingham.ac.uk/fees/tuitionfees/202526/undergraduate.aspx
2714,Agriculture BSc Hons,农业科学（BSc）,bachelor,1,https://www.nottingham.ac.uk/fees/tuitionfees/202526/undergraduate.aspx
2714,Ancient History BA Hons,古代史（BA）,bachelor,1,https://www.nottingham.ac.uk/fees/tuitionfees/202526/undergraduate.aspx
2714,Ancient History and Archaeology BA Jt Hons,古代史与考古学（BA）,bachelor,1,https://www.nottingham.ac.uk/fees/tuitionfees/202526/undergraduate.aspx
2714,Ancient History and History BA Jt Hons,古代史与历史（BA）,bachelor,1,https://www.nottingham.ac.uk/fees/tuitionfees/202526/undergraduate.aspx
2714,Animal Science BSc Hons,动物科学（BSc）,bachelor,1,https://www.nottingham.ac.uk/fees/tuitionfees/202526/undergraduate.aspx
2714,Animal Science MSci Hons,动物科学（MSci）,bachelor,1,https://www.nottingham.ac.uk/fees/tuitionfees/202526/undergraduate.aspx
2714,Archaeology BA Hons,考古学（BA）,bachelor,1,https://www.nottingham.ac.uk/fees/tuitionfees/202526/undergraduate.aspx
2714,Archaeology and Geography BA Jt Hons,考古学与地理（BA）,bachelor,1,https://www.nottingham.ac.uk/fees/tuitionfees/202526/undergraduate.aspx
2714,Archaeology and History BA Jt Hons,考古学与历史（BA）,bachelor,1,https://www.nottingham.ac.uk/fees/tuitionfees/202526/undergraduate.aspx
2714,Architectural Environment Engineering BEng Hons,建筑环境工程（BEng）,bachelor,1,https://www.nottingham.ac.uk/fees/tuitionfees/202526/undergraduate.aspx
2714,Architectural Environment Engineering MEng Hons,建筑环境工程（MEng）,bachelor,1,https://www.nottingham.ac.uk/fees/tuitionfees/202526/undergraduate.aspx
2714,Architectural Environment Engineering with Industrial Placement Year BEng Hons,建筑环境工程（行业实习年）（BEng）,bachelor,1,https://www.nottingham.ac.uk/fees/tuitionfees/202526/undergraduate.aspx
2714,Architectural Environment Engineering with Industrial Placement Year MEng Hons,建筑环境工程（行业实习年）（MEng）,bachelor,1,https://www.nottingham.ac.uk/fees/tuitionfees/202526/undergraduate.aspx
2714,Architecture BArch Hons,建筑学（BArch）,bachelor,1,https://www.nottingham.ac.uk/fees/tuitionfees/202526/undergraduate.aspx
2714,Architecture and Environmental Design MEng Hons,建筑学与环境设计（MEng）,bachelor,1,https://www.nottingham.ac.uk/fees/tuitionfees/202526/undergraduate.aspx
2714,Art History and Visual Culture BA Hons,艺术史与视觉文化（BA）,bachelor,1,https://www.nottingham.ac.uk/fees/tuitionfees/202526/undergraduate.aspx
2714,Arts and Humanities with Foundation Year BA Hons,艺术与人文（含预科年）（BA）,bachelor,1,https://www.nottingham.ac.uk/fees/tuitionfees/202526/undergraduate.aspx
2714,Biochemistry BSc Hons,生物化学（BSc）,bachelor,1,https://www.nottingham.ac.uk/fees/tuitionfees/202526/undergraduate.aspx
2714,Biochemistry MSci Hons,生物化学（MSci）,bachelor,1,https://www.nottingham.ac.uk/fees/tuitionfees/202526/undergraduate.aspx
2714,Biology BSc Hons,生物学（BSc）,bachelor,1,https://www.nottingham.ac.uk/fees/tuitionfees/202526/undergraduate.aspx
2714,Biology MSci Hons,生物学（MSci）,bachelor,1,https://www.nottingham.ac.uk/fees/tuitionfees/202526/undergraduate.aspx
2714,Biotechnology BSc Hons,生物技术（BSc）,bachelor,1,https://www.nottingham.ac.uk/fees/tuitionfees/202526/undergraduate.aspx
2714,Biotechnology MSci Hons,生物技术（MSci）,bachelor,1,https://www.nottingham.ac.uk/fees/tuitionfees/202526/undergraduate.aspx
2714,Cancer Sciences BSc Hons,肿瘤科学（BSc）,bachelor,1,https://www.nottingham.ac.uk/fees/tuitionfees/202526/undergraduate.aspx
2714,Cancer Sciences MSci Hons,肿瘤科学（MSci）,bachelor,1,https://www.nottingham.ac.uk/fees/tuitionfees/202526/undergraduate.aspx
2714,Chemical Engineering BEng Hons,化学工程（BEng）,bachelor,1,https://www.nottingham.ac.uk/fees/tuitionfees/202526/undergraduate.aspx
2714,Chemical Engineering MEng Hons,化学工程（MEng）,bachelor,1,https://www.nottingham.ac.uk/fees/tuitionfees/202526/undergraduate.aspx
2714,Chemical Engineering including an Industrial Year MEng Hons,化学工程（行业实习年）（MEng）,bachelor,1,https://www.nottingham.ac.uk/fees/tuitionfees/202526/undergraduate.aspx
2714,Chemical Engineering with Environmental Engineering BEng Hons,化学工程含环境工程（BEng）,bachelor,1,https://www.nottingham.ac.uk/fees/tuitionfees/202526/undergraduate.aspx
2714,Chemical Engineering with Environmental Engineering MEng Hons,化学工程含环境工程（MEng）,bachelor,1,https://www.nottingham.ac.uk/fees/tuitionfees/202526/undergraduate.aspx
2714,Chemical Engineering with Environmental Engineering including an Industrial Year BEng Hons,化学工程含环境工程（行业实习年）（BEng）,bachelor,1,https://www.nottingham.ac.uk/fees/tuitionfees/202526/undergraduate.aspx
2714,Chemical Engineering with Environmental Engineering including an Industrial Year MEng Hons,化学工程含环境工程（行业实习年）（MEng）,bachelor,1,https://www.nottingham.ac.uk/fees/tuitionfees/202526/undergraduate.aspx
2714,Chemistry BSc Hons,化学（BSc）,bachelor,1,https://www.nottingham.ac.uk/fees/tuitionfees/202526/undergraduate.aspx
2714,Chemistry MSci Hons,化学（MSci）,bachelor,1,https://www.nottingham.ac.uk/fees/tuitionfees/202526/undergraduate.aspx
2714,Chemistry with a Year in Industry MSci Hons,化学（行业实习年）（MSci）,bachelor,1,https://www.nottingham.ac.uk/fees/tuitionfees/202526/undergraduate.aspx
2714,Chemistry with an International Study Year MSci Hons,化学含国际研究年（MSci）,bachelor,1,https://www.nottingham.ac.uk/fees/tuitionfees/202526/undergraduate.aspx
2714,Civil Engineering BEng Hons,土木工程（BEng）,bachelor,1,https://www.nottingham.ac.uk/fees/tuitionfees/202526/undergraduate.aspx
2714,Civil Engineering MEng Hons,土木工程（MEng）,bachelor,1,https://www.nottingham.ac.uk/fees/tuitionfees/202526/undergraduate.aspx
2714,Civil Engineering including an Industrial Year BEng Hons,土木工程（行业实习年）（BEng）,bachelor,1,https://www.nottingham.ac.uk/fees/tuitionfees/202526/undergraduate.aspx
2714,Civil Engineering including an Industrial Year MEng Hons,土木工程（行业实习年）（MEng）,bachelor,1,https://www.nottingham.ac.uk/fees/tuitionfees/202526/undergraduate.aspx
2714,Classical Civilisation BA Hons,古典文明（BA）,bachelor,1,https://www.nottingham.ac.uk/fees/tuitionfees/202526/undergraduate.aspx
2714,Classical Civilisation and Philosophy BA Jt Hons,古典文明与哲学（BA）,bachelor,1,https://www.nottingham.ac.uk/fees/tuitionfees/202526/undergraduate.aspx
2714,Classics BA Hons,古典学（BA）,bachelor,1,https://www.nottingham.ac.uk/fees/tuitionfees/202526/undergraduate.aspx
2714,Classics and English BA Jt Hons,古典学与英语（BA）,bachelor,1,https://www.nottingham.ac.uk/fees/tuitionfees/202526/undergraduate.aspx
2714,Computer Science BSc Hons,计算机科学（BSc）,bachelor,1,https://www.nottingham.ac.uk/fees/tuitionfees/202526/undergraduate.aspx
2714,Computer Science MSci Hons,计算机科学（MSci）,bachelor,1,https://www.nottingham.ac.uk/fees/tuitionfees/202526/undergraduate.aspx
2714,Computer Science and Artificial Intelligence with Year in Industry BSc Hons,计算机科学与人工智能（行业实习年）（BSc）,bachelor,1,https://www.nottingham.ac.uk/fees/tuitionfees/202526/undergraduate.aspx
2714,Computer Science including International Year MSci Hons,计算机科学含国际年（MSci）,bachelor,1,https://www.nottingham.ac.uk/fees/tuitionfees/202526/undergraduate.aspx
2714,Computer Science with Artificial Intelligence BSc Hons,计算机科学含人工智能（BSc）,bachelor,1,https://www.nottingham.ac.uk/fees/tuitionfees/202526/undergraduate.aspx
2714,Computer Science with Artificial Intelligence MSci Hons,计算机科学含人工智能（MSci）,bachelor,1,https://www.nottingham.ac.uk/fees/tuitionfees/202526/undergraduate.aspx
2714,Computer Science with Artificial Intelligence including International Year MSci Hons,计算机科学含人工智能含国际年（MSci）,bachelor,1,https://www.nottingham.ac.uk/fees/tuitionfees/202526/undergraduate.aspx
2714,Computer Science with Year in Industry BSc Hons,计算机科学（行业实习年）（BSc）,bachelor,1,https://www.nottingham.ac.uk/fees/tuitionfees/202526/undergraduate.aspx
2714,Criminology BA Hons,犯罪学（BA）,bachelor,1,https://www.nottingham.ac.uk/fees/tuitionfees/202526/undergraduate.aspx
2714,Criminology and Sociology BA Jt Hons,犯罪学与社会学（BA）,bachelor,1,https://www.nottingham.ac.uk/fees/tuitionfees/202526/undergraduate.aspx
2714,Cultural and Creative Industries BA Hons,文化与创意产业（BA）,bachelor,1,https://www.nottingham.ac.uk/fees/tuitionfees/202526/undergraduate.aspx
2714,Economics BSc Hons,经济学（BSc）,bachelor,1,https://www.nottingham.ac.uk/fees/tuitionfees/202526/undergraduate.aspx
2714,Economics and Econometrics BSc Hons,经济学与计量经济学（BSc）,bachelor,1,https://www.nottingham.ac.uk/fees/tuitionfees/202526/undergraduate.aspx
2714,Economics and International Economics BSc Hons,经济学与国际经济学（BSc）,bachelor,1,https://www.nottingham.ac.uk/fees/tuitionfees/202526/undergraduate.aspx
2714,Economics with French BA Hons,经济学含法语（BA）,bachelor,1,https://www.nottingham.ac.uk/fees/tuitionfees/202526/undergraduate.aspx
2714,Economics with German BA Hons,经济学含德语（BA）,bachelor,1,https://www.nottingham.ac.uk/fees/tuitionfees/202526/undergraduate.aspx
2714,Economics with Hispanic Studies BA Hons,经济学含西班牙语国家研究（BA）,bachelor,1,https://www.nottingham.ac.uk/fees/tuitionfees/202526/undergraduate.aspx
2714,Education BA Hons,教育（BA）,bachelor,1,https://www.nottingham.ac.uk/fees/tuitionfees/202526/undergraduate.aspx
2714,Electrical Engineering BEng Hons,电气工程（BEng）,bachelor,1,https://www.nottingham.ac.uk/fees/tuitionfees/202526/undergraduate.aspx
2714,Electrical Engineering MEng Hons,电气工程（MEng）,bachelor,1,https://www.nottingham.ac.uk/fees/tuitionfees/202526/undergraduate.aspx
2714,Electrical Engineering with a Year Abroad (year 2) MEng Hons,电气工程含年海外（MEng）,bachelor,1,https://www.nottingham.ac.uk/fees/tuitionfees/202526/undergraduate.aspx
2714,Electrical Engineering with a Year Abroad (year 3) MEng Hons,电气工程含年海外（MEng）,bachelor,1,https://www.nottingham.ac.uk/fees/tuitionfees/202526/undergraduate.aspx
2714,Electrical Engineering with a Year Abroad BEng Hons,电气工程含年海外（BEng）,bachelor,1,https://www.nottingham.ac.uk/fees/tuitionfees/202526/undergraduate.aspx
2714,Electrical Engineering with a Year in Industry (year 3) MEng Hons,电气工程（行业实习年）（MEng）,bachelor,1,https://www.nottingham.ac.uk/fees/tuitionfees/202526/undergraduate.aspx
2714,Electrical Engineering with a Year in Industry (year 4) MEng Hons,电气工程（行业实习年）（MEng）,bachelor,1,https://www.nottingham.ac.uk/fees/tuitionfees/202526/undergraduate.aspx
2714,Electrical Engineering including an Industrial Year BEng Hons,电气工程（行业实习年）（BEng）,bachelor,1,https://www.nottingham.ac.uk/fees/tuitionfees/202526/undergraduate.aspx
2714,Electrical and Electronic Engineering BEng Hons,电气与电子工程（BEng）,bachelor,1,https://www.nottingham.ac.uk/fees/tuitionfees/202526/undergraduate.aspx
2714,Electrical and Electronic Engineering MEng Hons,电气与电子工程（MEng）,bachelor,1,https://www.nottingham.ac.uk/fees/tuitionfees/202526/undergraduate.aspx
2714,Electrical and Electronic Engineering including an Industrial Year (year 3) MEng Hons,电气与电子工程（行业实习年）（MEng）,bachelor,1,https://www.nottingham.ac.uk/fees/tuitionfees/202526/undergraduate.aspx
2714,Electrical and Electronic Engineering with a Year Abroad BEng Hons,电气与电子工程含年海外（BEng）,bachelor,1,https://www.nottingham.ac.uk/fees/tuitionfees/202526/undergraduate.aspx
2714,Electrical and Electronic Engineering with a Year Abroad MEng Hons,电气与电子工程含年海外（MEng）,bachelor,1,https://www.nottingham.ac.uk/fees/tuitionfees/202526/undergraduate.aspx
2714,Electrical and Electronic Engineering including an Industrial Year (year 4) MEng Hons,电气与电子工程（行业实习年）（MEng）,bachelor,1,https://www.nottingham.ac.uk/fees/tuitionfees/202526/undergraduate.aspx
2714,Electrical and Electronic Engineering including an Industrial Year BEng Hons,电气与电子工程（行业实习年）（BEng）,bachelor,1,https://www.nottingham.ac.uk/fees/tuitionfees/202526/undergraduate.aspx
2714,Electronic Engineering BEng Hons,电子工程（BEng）,bachelor,1,https://www.nottingham.ac.uk/fees/tuitionfees/202526/undergraduate.aspx
2714,Electronic Engineering MEng Hons,电子工程（MEng）,bachelor,1,https://www.nottingham.ac.uk/fees/tuitionfees/202526/undergraduate.aspx
2714,Electronic Engineering with a Year Abroad (year 2) MEng Hons,电子工程含年海外（MEng）,bachelor,1,https://www.nottingham.ac.uk/fees/tuitionfees/202526/undergraduate.aspx
2714,Electronic Engineering with a Year Abroad (year 3) MEng Hons,电子工程含年海外（MEng）,bachelor,1,https://www.nottingham.ac.uk/fees/tuitionfees/202526/undergraduate.aspx
2714,Electronic Engineering with a Year Abroad BEng Hons,电子工程含年海外（BEng）,bachelor,1,https://www.nottingham.ac.uk/fees/tuitionfees/202526/undergraduate.aspx
2714,Electronic Engineering with a Year in Industry (year 3) MEng Hons,电子工程（行业实习年）（MEng）,bachelor,1,https://www.nottingham.ac.uk/fees/tuitionfees/202526/undergraduate.aspx
2714,Electronic Engineering with a Year in Industry (year 4) MEng Hons,电子工程（行业实习年）（MEng）,bachelor,1,https://www.nottingham.ac.uk/fees/tuitionfees/202526/undergraduate.aspx
2714,Electronic Engineering with a Year in Industry BEng Hons,电子工程（行业实习年）（BEng）,bachelor,1,https://www.nottingham.ac.uk/fees/tuitionfees/202526/undergraduate.aspx
2714,Electronic and Computer Engineering BEng Hons,电子与计算机工程（BEng）,bachelor,1,https://www.nottingham.ac.uk/fees/tuitionfees/202526/undergraduate.aspx
2714,Electronic and Computer Engineering MEng Hons,电子与计算机工程（MEng）,bachelor,1,https://www.nottingham.ac.uk/fees/tuitionfees/202526/undergraduate.aspx
2714,Electronic and Computer Engineering with a Year Abroad (year 2) MEng Hons,电子与计算机工程含年海外（MEng）,bachelor,1,https://www.nottingham.ac.uk/fees/tuitionfees/202526/undergraduate.aspx
2714,Electronic and Computer Engineering with a Year Abroad (year 3) MEng Hons,电子与计算机工程含年海外（MEng）,bachelor,1,https://www.nottingham.ac.uk/fees/tuitionfees/202526/undergraduate.aspx
2714,Electronic and Computer Engineering with a Year Abroad BEng Hons,电子与计算机工程含年海外（BEng）,bachelor,1,https://www.nottingham.ac.uk/fees/tuitionfees/202526/undergraduate.aspx
2714,Electronic and Computer Engineering with a Year in Industry (year 3) MEng Hons,电子与计算机工程（行业实习年）（MEng）,bachelor,1,https://www.nottingham.ac.uk/fees/tuitionfees/202526/undergraduate.aspx
2714,Electronic and Computer Engineering with a Year in Industry (year 4) MEng Hons,电子与计算机工程（行业实习年）（MEng）,bachelor,1,https://www.nottingham.ac.uk/fees/tuitionfees/202526/undergraduate.aspx
2714,Electronic and Computer Engineering with a Year in Industry BEng Hons,电子与计算机工程（行业实习年）（BEng）,bachelor,1,https://www.nottingham.ac.uk/fees/tuitionfees/202526/undergraduate.aspx
2714,Engineering and Physical Sciences MEng Hons,工程与物理科学（MEng）,bachelor,1,https://www.nottingham.ac.uk/fees/tuitionfees/202526/undergraduate.aspx
2714,English BA Hons,英语（BA）,bachelor,1,https://www.nottingham.ac.uk/fees/tuitionfees/202526/undergraduate.aspx
2714,English Language and Literature BA Hons,英语语言与文学（BA）,bachelor,1,https://www.nottingham.ac.uk/fees/tuitionfees/202526/undergraduate.aspx
2714,English and French BA Jt Hons,英语与法语（BA）,bachelor,1,https://www.nottingham.ac.uk/fees/tuitionfees/202526/undergraduate.aspx
2714,English and Hispanic Studies BA Jt Hons,英语与西班牙语国家研究（BA）,bachelor,1,https://www.nottingham.ac.uk/fees/tuitionfees/202526/undergraduate.aspx
2714,English and History BA Jt Hons,英语与历史（BA）,bachelor,1,https://www.nottingham.ac.uk/fees/tuitionfees/202526/undergraduate.aspx
2714,English and Philosophy BA Jt Hons,英语与哲学（BA）,bachelor,1,https://www.nottingham.ac.uk/fees/tuitionfees/202526/undergraduate.aspx
2714,English with Creative Writing BA Hons,英语含创意写作（BA）,bachelor,1,https://www.nottingham.ac.uk/fees/tuitionfees/202526/undergraduate.aspx
2714,Environmental Biology BSc Hons,环境生物学（BSc）,bachelor,1,https://www.nottingham.ac.uk/fees/tuitionfees/202526/undergraduate.aspx
2714,Environmental Biology MSci Hons,环境生物学（MSci）,bachelor,1,https://www.nottingham.ac.uk/fees/tuitionfees/202526/undergraduate.aspx
2714,Environmental Engineering BEng Hons,环境工程（BEng）,bachelor,1,https://www.nottingham.ac.uk/fees/tuitionfees/202526/undergraduate.aspx
2714,Environmental Engineering MEng Hons,环境工程（MEng）,bachelor,1,https://www.nottingham.ac.uk/fees/tuitionfees/202526/undergraduate.aspx
2714,Environmental Engineering including an Industrial Year BEng Hons,环境工程（行业实习年）（BEng）,bachelor,1,https://www.nottingham.ac.uk/fees/tuitionfees/202526/undergraduate.aspx
2714,Environmental Engineering including an Industrial Year MEng Hons,环境工程（行业实习年）（MEng）,bachelor,1,https://www.nottingham.ac.uk/fees/tuitionfees/202526/undergraduate.aspx
2714,Environmental Science BSc Hons,环境科学（BSc）,bachelor,1,https://www.nottingham.ac.uk/fees/tuitionfees/202526/undergraduate.aspx
2714,Environmental Science MSci Hons,环境科学（MSci）,bachelor,1,https://www.nottingham.ac.uk/fees/tuitionfees/202526/undergraduate.aspx
2714,Film and Screen Studies BA Hons,电影与影视研究（BA）,bachelor,1,https://www.nottingham.ac.uk/fees/tuitionfees/202526/undergraduate.aspx
2714,"Finance, Accounting and Management BSc Hons","金融,会计与管理（BSc）",bachelor,1,https://www.nottingham.ac.uk/fees/tuitionfees/202526/undergraduate.aspx
2714,Financial Mathematics BSc Hons,金融数学（BSc）,bachelor,1,https://www.nottingham.ac.uk/fees/tuitionfees/202526/undergraduate.aspx
2714,Food Science BSc Hons,食品科学（BSc）,bachelor,1,https://www.nottingham.ac.uk/fees/tuitionfees/202526/undergraduate.aspx
2714,Food Science and Nutrition BSc Hons,食品科学与营养学（BSc）,bachelor,1,https://www.nottingham.ac.uk/fees/tuitionfees/202526/undergraduate.aspx
2714,French Studies BA Hons,法语研究（BA）,bachelor,1,https://www.nottingham.ac.uk/fees/tuitionfees/202526/undergraduate.aspx
2714,French and History BA Jt Hons,法语与历史（BA）,bachelor,1,https://www.nottingham.ac.uk/fees/tuitionfees/202526/undergraduate.aspx
2714,French and International Media and Communications Studies BA Jt Hons,法语与国际媒体与传播研究（BA）,bachelor,1,https://www.nottingham.ac.uk/fees/tuitionfees/202526/undergraduate.aspx
2714,French and Philosophy BA Jt Hons,法语与哲学（BA）,bachelor,1,https://www.nottingham.ac.uk/fees/tuitionfees/202526/undergraduate.aspx
2714,Geography BA Hons,地理学（BA）,bachelor,1,https://www.nottingham.ac.uk/fees/tuitionfees/202526/undergraduate.aspx
2714,Geography BSc Hons,地理学（BSc）,bachelor,1,https://www.nottingham.ac.uk/fees/tuitionfees/202526/undergraduate.aspx
2714,Geography with Business BA Hons,地理学（商业方向）（BA）,bachelor,1,https://www.nottingham.ac.uk/fees/tuitionfees/202526/undergraduate.aspx
2714,German BA Hons,德语（BA）,bachelor,1,https://www.nottingham.ac.uk/fees/tuitionfees/202526/undergraduate.aspx
2714,German and History BA Jt Hons,德语与历史（BA）,bachelor,1,https://www.nottingham.ac.uk/fees/tuitionfees/202526/undergraduate.aspx
2714,Health Promotion and Public Health BSc Hons,健康促进与公共卫生（BSc）,bachelor,1,https://www.nottingham.ac.uk/fees/tuitionfees/202526/undergraduate.aspx
2714,Health Sciences with Foundation Year Certificate (Foundation Year),健康科学（含预科年）（预科年）（Certificate）,bachelor,1,https://www.nottingham.ac.uk/fees/tuitionfees/202526/undergraduate.aspx
2714,Hispanic Studies BA Hons,西班牙语国家研究（BA）,bachelor,1,https://www.nottingham.ac.uk/fees/tuitionfees/202526/undergraduate.aspx
2714,Hispanic Studies and History BA Jt Hons,西班牙语国家研究与历史（BA）,bachelor,1,https://www.nottingham.ac.uk/fees/tuitionfees/202526/undergraduate.aspx
2714,History BA Hons,历史学（BA）,bachelor,1,https://www.nottingham.ac.uk/fees/tuitionfees/202526/undergraduate.aspx
2714,History and Contemporary Chinese Studies BA Jt Hons,历史与当代中国研究（BA）,bachelor,1,https://www.nottingham.ac.uk/fees/tuitionfees/202526/undergraduate.aspx
2714,History and East European Cultural Studies BA Jt Hons,历史与东亚欧洲文化研究（BA）,bachelor,1,https://www.nottingham.ac.uk/fees/tuitionfees/202526/undergraduate.aspx
2714,History and Philosophy BA Jt Hons,历史与哲学（BA）,bachelor,1,https://www.nottingham.ac.uk/fees/tuitionfees/202526/undergraduate.aspx
2714,History and Politics BA Jt Hons,历史与政治学（BA）,bachelor,1,https://www.nottingham.ac.uk/fees/tuitionfees/202526/undergraduate.aspx
2714,History of Art and English BA Jt Hons,历史艺术与英语（BA）,bachelor,1,https://www.nottingham.ac.uk/fees/tuitionfees/202526/undergraduate.aspx
2714,Industrial Economics BSc Hons,产业经济学（BSc）,bachelor,1,https://www.nottingham.ac.uk/fees/tuitionfees/202526/undergraduate.aspx
2714,Industrial Economics with Insurance BSc Hons,产业经济学含保险（BSc）,bachelor,1,https://www.nottingham.ac.uk/fees/tuitionfees/202526/undergraduate.aspx
2714,International Management BSc Hons,国际管理（BSc）,bachelor,1,https://www.nottingham.ac.uk/fees/tuitionfees/202526/undergraduate.aspx
2714,International Media and Communications Studies BA Hons,国际媒体与传播研究（BA）,bachelor,1,https://www.nottingham.ac.uk/fees/tuitionfees/202526/undergraduate.aspx
2714,International Relations and Asian Studies BA Hons,国际关系与亚洲研究（BA）,bachelor,1,https://www.nottingham.ac.uk/fees/tuitionfees/202526/undergraduate.aspx
2714,International Security Studies BA Hons,国际安全研究（BA）,bachelor,1,https://www.nottingham.ac.uk/fees/tuitionfees/202526/undergraduate.aspx
2714,Law BA Hons,法学（BA）,bachelor,1,https://www.nottingham.ac.uk/fees/tuitionfees/202526/undergraduate.aspx
2714,Law with French and French Law BA Hons,法学含法语与法语法学（BA）,bachelor,1,https://www.nottingham.ac.uk/fees/tuitionfees/202526/undergraduate.aspx
2714,Law with Spanish and Spanish Law BA Hons,法学含西班牙语与西班牙语法学（BA）,bachelor,1,https://www.nottingham.ac.uk/fees/tuitionfees/202526/undergraduate.aspx
2714,Liberal Arts BA Hons,博雅艺术（BA）,bachelor,1,https://www.nottingham.ac.uk/fees/tuitionfees/202526/undergraduate.aspx
2714,Management BSc Hons,管理（BSc）,bachelor,1,https://www.nottingham.ac.uk/fees/tuitionfees/202526/undergraduate.aspx
2714,Manufacturing Engineering BEng Hons,制造工程（BEng）,bachelor,1,https://www.nottingham.ac.uk/fees/tuitionfees/202526/undergraduate.aspx
2714,Manufacturing Engineering MEng Hons,制造工程（MEng）,bachelor,1,https://www.nottingham.ac.uk/fees/tuitionfees/202526/undergraduate.aspx
2714,Manufacturing Engineering including an Industrial Year BEng Hons,制造工程（行业实习年）（BEng）,bachelor,1,https://www.nottingham.ac.uk/fees/tuitionfees/202526/undergraduate.aspx
2714,Manufacturing Engineering including an Industrial Year MEng Hons,制造工程（行业实习年）（MEng）,bachelor,1,https://www.nottingham.ac.uk/fees/tuitionfees/202526/undergraduate.aspx
2714,Mathematical Physics BSc Hons,数理物理（BSc）,bachelor,1,https://www.nottingham.ac.uk/fees/tuitionfees/202526/undergraduate.aspx
2714,Mathematical Physics MSci Hons,数理物理（MSci）,bachelor,1,https://www.nottingham.ac.uk/fees/tuitionfees/202526/undergraduate.aspx
2714,Mathematics (International Study) BSc Hons,数学(国际研究)（BSc）,bachelor,1,https://www.nottingham.ac.uk/fees/tuitionfees/202526/undergraduate.aspx
2714,Mathematics BSc Hons,数学（BSc）,bachelor,1,https://www.nottingham.ac.uk/fees/tuitionfees/202526/undergraduate.aspx
2714,Mathematics MMath Hons,数学（MMath）,bachelor,1,https://www.nottingham.ac.uk/fees/tuitionfees/202526/undergraduate.aspx
